{
  "cells": [
    {
      "bold": false,
      "border": {
        "bottom": {
          "color": "#000000",
          "style": "none",
          "width": 1.0
        },
        "left": {
          "color": "#000000",
          "style": "none",
          "width": 1.0
        },
        "right": {
          "color": "#000000",
          "style": "none",
          "width": 1.0
        },
        "top": {
          "color": "#000000",
          "style": "none",
          "width": 1.0
        }
      },
      "col": 1,
      "extend_mode": "default",
      "font_name": "宋体",
      "font_size": 12,
      "fore_color": "#000000",
      "h_align": "left",
      "indent": 0.0,
      "italic": false,
      "literal": {
        "type": "text",
        "value": "Root 态：裸列"
      },
      "merge": {
        "cols": 2,
        "rows": 1
      },
      "rotation": 0.0,
      "row": 1,
      "split": false,
      "stretch_when_paged": false,
      "underline": false,
      "v_align": "middle"
    },
    {
      "bold": false,
      "border": {
        "bottom": {
          "color": "#000000",
          "style": "none",
          "width": 1.0
        },
        "left": {
          "color": "#000000",
          "style": "none",
          "width": 1.0
        },
        "right": {
          "color": "#000000",
          "style": "none",
          "width": 1.0
        },
        "top": {
          "color": "#000000",
          "style": "none",
          "width": 1.0
        }
      },
      "col": 1,
      "extend_mode": "default",
      "font_name": "宋体",
      "font_size": 12,
      "fore_color": "#000000",
      "h_align": "left",
      "indent": 0.0,
      "italic": false,
      "literal": {
        "type": "text",
        "value": "裸列"
      },
      "rotation": 0.0,
      "row": 2,
      "split": false,
      "stretch_when_paged": false,
      "underline": false,
      "v_align": "middle"
    },
    {
      "bold": false,
      "border": {
        "bottom": {
          "color": "#000000",
          "style": "none",
          "width": 1.0
        },
        "left": {
          "color": "#000000",
          "style": "none",
          "width": 1.0
        },
        "right": {
          "color": "#000000",
          "style": "none",
          "width": 1.0
        },
        "top": {
          "color": "#000000",
          "style": "none",
          "width": 1.0
        }
      },
      "col": 2,
      "extend_mode": "default",
      "font_name": "宋体",
      "font_size": 12,
      "fore_color": "#000000",
      "h_align": "left",
      "indent": 0.0,
      "italic": false,
      "literal": {
        "type": "text",
        "value": "值"
      },
      "rotation": 0.0,
      "row": 2,
      "split": false,
      "stretch_when_paged": false,
      "underline": false,
      "v_align": "middle"
    },
    {
      "bold": false,
      "border": {
        "bottom": {
          "color": "#000000",
          "style": "none",
          "width": 1.0
        },
        "left": {
          "color": "#000000",
          "style": "none",
          "width": 1.0
        },
        "right": {
          "color": "#000000",
          "style": "none",
          "width": 1.0
        },
        "top": {
          "color": "#000000",
          "style": "none",
          "width": 1.0
        }
      },
      "col": 1,
      "expr": "ds2.item",
      "extend_mode": "default",
      "font_name": "宋体",
      "font_size": 12,
      "fore_color": "#000000",
      "h_align": "left",
      "indent": 0.0,
      "italic": false,
      "rotation": 0.0,
      "row": 3,
      "split": false,
      "stretch_when_paged": false,
      "underline": false,
      "v_align": "middle"
    },
    {
      "bold": false,
      "border": {
        "bottom": {
          "color": "#000000",
          "style": "none",
          "width": 1.0
        },
        "left": {
          "color": "#000000",
          "style": "none",
          "width": 1.0
        },
        "right": {
          "color": "#000000",
          "style": "none",
          "width": 1.0
        },
        "top": {
          "color": "#000000",
          "style": "none",
          "width": 1.0
        }
      },
      "col": 2,
      "extend_mode": "default",
      "font_name": "宋体",
      "font_size": 12,
      "fore_color": "#000000",
      "h_align": "left",
      "indent": 0.0,
      "italic": false,
      "literal": {
        "type": "null",
        "value": null
      },
      "rotation": 0.0,
      "row": 3,
      "split": false,
      "stretch_when_paged": false,
      "underline": false,
      "v_align": "middle"
    }
  ],
  "col_props": [
    {
      "break_column": false,
      "break_page": false,
      "col": 1,
      "type": "data",
      "visible": true,
      "width": 25.0
    },
    {
      "break_column": false,
      "break_page": false,
      "col": 2,
      "type": "data",
      "visible": true,
      "width": 25.0
    }
  ],
  "datasets": [
    {
      "name": "ds1",
      "sql": {
        "dsn": "kingbase",
        "sql": "SELECT id, dept, name, salary FROM report.emp_info ORDER BY id"
      }
    },
    {
      "name": "ds2",
      "sql": {
        "dsn": "kingbase",
        "sql": "SELECT id, emp_id, item, amount FROM report.emp_bonus ORDER BY id"
      }
    }
  ],
  "extensions": {
    "rpx.legacy": {
      "data": "UlFRUgAABoEAAAAEAAAAAwAAABylQQAAAAEA//////////8BAAAABqztAAVwcAAAAAAAHKVBAAAAAQD//////////wEAAAAGrO0ABXBwAAAAAAAcpUEAAAABAP//////////AQAAAAas7QAFcHAAAAAAABqxQcgAAAEA//////////8AAAAGrO0ABXBwAAAAABqxQcgAAAEA//////////8AAAAGrO0ABXBwAAAAALcAAAAQAAAAAQAAAAEAAAABAAAAAtDhAP8AAAA/gAAAEP///////////////yIxAAEAEVJvb3Qg5oCB77ya6KO45YiX/////wAAAAAAAAAG5a6L5L2TAAz//////wAAAP///////////////wA/gAAA/wAAAAA/gAAA/wAAAAA/gAAA/wAAAAA/gAAA/wAAAP////8AIMD/////AAAAAAAGrO0ABXBw/////wD/////YXF2eQAAAAAAAACU/////9DhAP8AAAA/gAAAEP///////////////yIxAP//////AAAAAAAAAAblrovkvZMADP//////AAAA////////////////AD+AAAD/AAAAAD+AAAD/AAAAAD+AAAD/AAAAAD+AAAD/AAAA/////wAgwP////8AAAAAAAas7QAFcHD/////AP////9hcXZ5AAAAAAAAAJz/////0OEA/wAAAD+AAAAQ////////////////IjEAAQAG6KO45YiX/////wAAAAAAAAAG5a6L5L2TAAz//////wAAAP///////////////wA/gAAA/wAAAAA/gAAA/wAAAAA/gAAA/wAAAAA/gAAA/wAAAP////8AIMD/////AAAAAAAGrO0ABXBw/////wD/////YXF2eQAAAAAAAACZ/////9DhAP8AAAA/gAAAEP///////////////yIxAAEAA+WAvP////8AAAAAAAAABuWui+S9kwAM//////8AAAD///////////////8AP4AAAP8AAAAAP4AAAP8AAAAAP4AAAP8AAAAAP4AAAP8AAAD/////ACDA/////wAAAAAABqztAAVwcP////8A/////2FxdnkAAAAAAAAAov/////Q4QD/AAAAP4AAABD///////////////8iMQD//////wAAAAAAAAAG5a6L5L2TAAz//////wAAAP///////////////wA/gAAA/wAAAAA/gAAA/wAAAAA/gAAA/wAAAAA/gAAA/wAAAAAAAA4AASgBAAhkczIuaXRlbQAgwP////8AAAAAAAas7QAFcHD/////AP////9hcXZ5AAAAAAAAAJT/////0OEA/wAAAD+AAAAQ////////////////IjEA//////8AAAAAAAAABuWui+S9kwAM//////8AAAD///////////////8AP4AAAP8AAAAAP4AAAP8AAAAAP4AAAP8AAAAAP4AAAP8AAAD/////ACDA/////wAAAAAABqztAAVwcP////8A/////2FxdnkAAAAAAAAAQwAJAAEAAQABAAAAFAABAAEAZENSAABDlIAAQZgAAEGYAABByAAAQcgAAAEAAAIAAAIAAgEBAAD/////AAAAAAEAAAD//////////wAAAVUAAgEAAAAuY29tLnJhcXNvZnQucmVwb3J0bC51c2VybW9kZWwuU1FMRGF0YVNldENvbmZpZwAAAHEAAAAYAAAAA2RzMQAAAAhraW5nYmFzZQAAAAAAAAAAPlNFTEVDVCBpZCwgZGVwdCwgbmFtZSwgc2FsYXJ5IEZST00gcmVwb3J0LmVtcF9pbmZvIE9SREVSIEJZIGlk////////////////AAAAAAAAAAEAAAAuY29tLnJhcXNvZnQucmVwb3J0bC51c2VybW9kZWwuU1FMRGF0YVNldENvbmZpZwAAAHQAAAAYAAAAA2RzMgAAAAhraW5nYmFzZQAAAAAAAAAAQVNFTEVDVCBpZCwgZW1wX2lkLCBpdGVtLCBhbW91bnQgRlJPTSByZXBvcnQuZW1wX2JvbnVzIE9SREVSIEJZIGlk////////////////AAAAAAAAAP//////////AAAAH///////////AAAPPP////8DAQAAAAACAAAAAf////8AAACFAf////8A//////////8AAAAAAAAAAAH/////AAAAAP//////////////////////////Af////9SUVFSUlFRUg==",
      "encoding": "base64",
      "format": "rpx-rpx-v1",
      "modeled_sha256": "eb81f68fbca495bbfb5ca3043e0ff54ff27a80140e47ddb9599bbca8e0ae9413",
      "sha256": "a17d9cda62a2271b98b94f9d7f7ae210273823c2f6ba3bd846fc57ffa4b09d3d"
    }
  },
  "format": "rpx-report",
  "format_version": 1,
  "grid": {
    "cols": 2,
    "rows": 3
  },
  "row_props": [
    {
      "adjust_height": false,
      "break_column": false,
      "break_page": false,
      "height": 8.0,
      "row": 1,
      "type": "data",
      "visible": true
    },
    {
      "adjust_height": false,
      "break_column": false,
      "break_page": false,
      "height": 8.0,
      "row": 2,
      "type": "data",
      "visible": true
    },
    {
      "adjust_height": false,
      "break_column": false,
      "break_page": false,
      "height": 8.0,
      "row": 3,
      "type": "data",
      "visible": true
    }
  ],
  "schema": "rpx-report/v1",
  "version": 1
}
