{
  "cells": [
    {
      "bold": false,
      "border": {
        "bottom": {
          "color": "#000000",
          "style": "none",
          "width": 1.0
        },
        "left": {
          "color": "#000000",
          "style": "none",
          "width": 1.0
        },
        "right": {
          "color": "#000000",
          "style": "none",
          "width": 1.0
        },
        "top": {
          "color": "#000000",
          "style": "none",
          "width": 1.0
        }
      },
      "col": 1,
      "extend_mode": "default",
      "font_name": "宋体",
      "font_size": 12,
      "fore_color": "#000000",
      "h_align": "left",
      "indent": 0.0,
      "italic": false,
      "literal": {
        "type": "text",
        "value": "Root 态：降序List"
      },
      "merge": {
        "cols": 2,
        "rows": 1
      },
      "rotation": 0.0,
      "row": 1,
      "split": false,
      "stretch_when_paged": false,
      "underline": false,
      "v_align": "middle"
    },
    {
      "bold": false,
      "border": {
        "bottom": {
          "color": "#000000",
          "style": "none",
          "width": 1.0
        },
        "left": {
          "color": "#000000",
          "style": "none",
          "width": 1.0
        },
        "right": {
          "color": "#000000",
          "style": "none",
          "width": 1.0
        },
        "top": {
          "color": "#000000",
          "style": "none",
          "width": 1.0
        }
      },
      "col": 1,
      "extend_mode": "default",
      "font_name": "宋体",
      "font_size": 12,
      "fore_color": "#000000",
      "h_align": "left",
      "indent": 0.0,
      "italic": false,
      "literal": {
        "type": "text",
        "value": "降序List"
      },
      "rotation": 0.0,
      "row": 2,
      "split": false,
      "stretch_when_paged": false,
      "underline": false,
      "v_align": "middle"
    },
    {
      "bold": false,
      "border": {
        "bottom": {
          "color": "#000000",
          "style": "none",
          "width": 1.0
        },
        "left": {
          "color": "#000000",
          "style": "none",
          "width": 1.0
        },
        "right": {
          "color": "#000000",
          "style": "none",
          "width": 1.0
        },
        "top": {
          "color": "#000000",
          "style": "none",
          "width": 1.0
        }
      },
      "col": 2,
      "extend_mode": "default",
      "font_name": "宋体",
      "font_size": 12,
      "fore_color": "#000000",
      "h_align": "left",
      "indent": 0.0,
      "italic": false,
      "literal": {
        "type": "text",
        "value": "值"
      },
      "rotation": 0.0,
      "row": 2,
      "split": false,
      "stretch_when_paged": false,
      "underline": false,
      "v_align": "middle"
    },
    {
      "bold": false,
      "border": {
        "bottom": {
          "color": "#000000",
          "style": "none",
          "width": 1.0
        },
        "left": {
          "color": "#000000",
          "style": "none",
          "width": 1.0
        },
        "right": {
          "color": "#000000",
          "style": "none",
          "width": 1.0
        },
        "top": {
          "color": "#000000",
          "style": "none",
          "width": 1.0
        }
      },
      "col": 1,
      "expr": "ds2.select(item:-1)",
      "extend_mode": "default",
      "font_name": "宋体",
      "font_size": 12,
      "fore_color": "#000000",
      "h_align": "left",
      "indent": 0.0,
      "italic": false,
      "rotation": 0.0,
      "row": 3,
      "split": false,
      "stretch_when_paged": false,
      "underline": false,
      "v_align": "middle"
    },
    {
      "bold": false,
      "border": {
        "bottom": {
          "color": "#000000",
          "style": "none",
          "width": 1.0
        },
        "left": {
          "color": "#000000",
          "style": "none",
          "width": 1.0
        },
        "right": {
          "color": "#000000",
          "style": "none",
          "width": 1.0
        },
        "top": {
          "color": "#000000",
          "style": "none",
          "width": 1.0
        }
      },
      "col": 2,
      "extend_mode": "default",
      "font_name": "宋体",
      "font_size": 12,
      "fore_color": "#000000",
      "h_align": "left",
      "indent": 0.0,
      "italic": false,
      "literal": {
        "type": "null",
        "value": null
      },
      "rotation": 0.0,
      "row": 3,
      "split": false,
      "stretch_when_paged": false,
      "underline": false,
      "v_align": "middle"
    }
  ],
  "col_props": [
    {
      "break_column": false,
      "break_page": false,
      "col": 1,
      "type": "data",
      "visible": true,
      "width": 25.0
    },
    {
      "break_column": false,
      "break_page": false,
      "col": 2,
      "type": "data",
      "visible": true,
      "width": 25.0
    }
  ],
  "datasets": [
    {
      "name": "ds1",
      "sql": {
        "dsn": "kingbase",
        "sql": "SELECT id, dept, name, salary FROM report.emp_info ORDER BY id"
      }
    },
    {
      "name": "ds2",
      "sql": {
        "dsn": "kingbase",
        "sql": "SELECT id, emp_id, item, amount FROM report.emp_bonus ORDER BY id"
      }
    }
  ],
  "extensions": {
    "rpx.legacy": {
      "data": "UlFRUgAABpQAAAAEAAAAAwAAABylQQAAAAEA//////////8BAAAABqztAAVwcAAAAAAAHKVBAAAAAQD//////////wEAAAAGrO0ABXBwAAAAAAAcpUEAAAABAP//////////AQAAAAas7QAFcHAAAAAAABqxQcgAAAEA//////////8AAAAGrO0ABXBwAAAAABqxQcgAAAEA//////////8AAAAGrO0ABXBwAAAAALsAAAAQAAAAAQAAAAEAAAABAAAAAtDhAP8AAAA/gAAAEP///////////////yIxAAEAFVJvb3Qg5oCB77ya6ZmN5bqPTGlzdP////8AAAAAAAAABuWui+S9kwAM//////8AAAD///////////////8AP4AAAP8AAAAAP4AAAP8AAAAAP4AAAP8AAAAAP4AAAP8AAAD/////ACDA/////wAAAAAABqztAAVwcP////8A/////2FxdnkAAAAAAAAAlP/////Q4QD/AAAAP4AAABD///////////////8iMQD//////wAAAAAAAAAG5a6L5L2TAAz//////wAAAP///////////////wA/gAAA/wAAAAA/gAAA/wAAAAA/gAAA/wAAAAA/gAAA/wAAAP////8AIMD/////AAAAAAAGrO0ABXBw/////wD/////YXF2eQAAAAAAAACg/////9DhAP8AAAA/gAAAEP///////////////yIxAAEACumZjeW6j0xpc3T/////AAAAAAAAAAblrovkvZMADP//////AAAA////////////////AD+AAAD/AAAAAD+AAAD/AAAAAD+AAAD/AAAAAD+AAAD/AAAA/////wAgwP////8AAAAAAAas7QAFcHD/////AP////9hcXZ5AAAAAAAAAJn/////0OEA/wAAAD+AAAAQ////////////////IjEAAQAD5YC8/////wAAAAAAAAAG5a6L5L2TAAz//////wAAAP///////////////wA/gAAA/wAAAAA/gAAA/wAAAAA/gAAA/wAAAAA/gAAA/wAAAP////8AIMD/////AAAAAAAGrO0ABXBw/////wD/////YXF2eQAAAAAAAACt/////9DhAP8AAAA/gAAAEP///////////////yIxAP//////AAAAAAAAAAblrovkvZMADP//////AAAA////////////////AD+AAAD/AAAAAD+AAAD/AAAAAD+AAAD/AAAAAD+AAAD/AAAAAAAAGQABKAEAE2RzMi5zZWxlY3QoaXRlbTotMSkAIMD/////AAAAAAAGrO0ABXBw/////wD/////YXF2eQAAAAAAAACU/////9DhAP8AAAA/gAAAEP///////////////yIxAP//////AAAAAAAAAAblrovkvZMADP//////AAAA////////////////AD+AAAD/AAAAAD+AAAD/AAAAAD+AAAD/AAAAAD+AAAD/AAAA/////wAgwP////8AAAAAAAas7QAFcHD/////AP////9hcXZ5AAAAAAAAAEMACQABAAEAAQAAABQAAQABAGRDUgAAQ5SAAEGYAABBmAAAQcgAAEHIAAABAAACAAACAAIBAQAA/////wAAAAABAAAA//////////8AAAFVAAIBAAAALmNvbS5yYXFzb2Z0LnJlcG9ydGwudXNlcm1vZGVsLlNRTERhdGFTZXRDb25maWcAAABxAAAAGAAAAANkczEAAAAIa2luZ2Jhc2UAAAAAAAAAAD5TRUxFQ1QgaWQsIGRlcHQsIG5hbWUsIHNhbGFyeSBGUk9NIHJlcG9ydC5lbXBfaW5mbyBPUkRFUiBCWSBpZP///////////////wAAAAAAAAABAAAALmNvbS5yYXFzb2Z0LnJlcG9ydGwudXNlcm1vZGVsLlNRTERhdGFTZXRDb25maWcAAAB0AAAAGAAAAANkczIAAAAIa2luZ2Jhc2UAAAAAAAAAAEFTRUxFQ1QgaWQsIGVtcF9pZCwgaXRlbSwgYW1vdW50IEZST00gcmVwb3J0LmVtcF9ib251cyBPUkRFUiBCWSBpZP///////////////wAAAAAAAAD//////////wAAAB///////////wAADzz/////AwEAAAAAAgAAAAH/////AAAAhQH/////AP//////////AAAAAAAAAAAB/////wAAAAD//////////////////////////wH/////UlFRUlJRUVI=",
      "encoding": "base64",
      "format": "rpx-rpx-v1",
      "modeled_sha256": "a28a62264d96e1eaf5b51d62ea7743428e93590d98b2333a78dedad648ad5559",
      "sha256": "5185ed538db748ae932c9dd73d241b38cea540c6560c3e616a39b0cf0ec65281"
    }
  },
  "format": "rpx-report",
  "format_version": 1,
  "grid": {
    "cols": 2,
    "rows": 3
  },
  "row_props": [
    {
      "adjust_height": false,
      "break_column": false,
      "break_page": false,
      "height": 8.0,
      "row": 1,
      "type": "data",
      "visible": true
    },
    {
      "adjust_height": false,
      "break_column": false,
      "break_page": false,
      "height": 8.0,
      "row": 2,
      "type": "data",
      "visible": true
    },
    {
      "adjust_height": false,
      "break_column": false,
      "break_page": false,
      "height": 8.0,
      "row": 3,
      "type": "data",
      "visible": true
    }
  ],
  "schema": "rpx-report/v1",
  "version": 1
}
