{
  "cells": [
    {
      "bold": false,
      "border": {
        "bottom": {
          "color": "#000000",
          "style": "none",
          "width": 1.0
        },
        "left": {
          "color": "#000000",
          "style": "none",
          "width": 1.0
        },
        "right": {
          "color": "#000000",
          "style": "none",
          "width": 1.0
        },
        "top": {
          "color": "#000000",
          "style": "none",
          "width": 1.0
        }
      },
      "col": 1,
      "extend_mode": "default",
      "font_name": "宋体",
      "font_size": 12,
      "fore_color": "#000000",
      "h_align": "left",
      "indent": 0.0,
      "italic": false,
      "literal": {
        "type": "text",
        "value": "Root 态：去重List"
      },
      "merge": {
        "cols": 2,
        "rows": 1
      },
      "rotation": 0.0,
      "row": 1,
      "split": false,
      "stretch_when_paged": false,
      "underline": false,
      "v_align": "middle"
    },
    {
      "bold": false,
      "border": {
        "bottom": {
          "color": "#000000",
          "style": "none",
          "width": 1.0
        },
        "left": {
          "color": "#000000",
          "style": "none",
          "width": 1.0
        },
        "right": {
          "color": "#000000",
          "style": "none",
          "width": 1.0
        },
        "top": {
          "color": "#000000",
          "style": "none",
          "width": 1.0
        }
      },
      "col": 1,
      "extend_mode": "default",
      "font_name": "宋体",
      "font_size": 12,
      "fore_color": "#000000",
      "h_align": "left",
      "indent": 0.0,
      "italic": false,
      "literal": {
        "type": "text",
        "value": "去重List"
      },
      "rotation": 0.0,
      "row": 2,
      "split": false,
      "stretch_when_paged": false,
      "underline": false,
      "v_align": "middle"
    },
    {
      "bold": false,
      "border": {
        "bottom": {
          "color": "#000000",
          "style": "none",
          "width": 1.0
        },
        "left": {
          "color": "#000000",
          "style": "none",
          "width": 1.0
        },
        "right": {
          "color": "#000000",
          "style": "none",
          "width": 1.0
        },
        "top": {
          "color": "#000000",
          "style": "none",
          "width": 1.0
        }
      },
      "col": 2,
      "extend_mode": "default",
      "font_name": "宋体",
      "font_size": 12,
      "fore_color": "#000000",
      "h_align": "left",
      "indent": 0.0,
      "italic": false,
      "literal": {
        "type": "text",
        "value": "值"
      },
      "rotation": 0.0,
      "row": 2,
      "split": false,
      "stretch_when_paged": false,
      "underline": false,
      "v_align": "middle"
    },
    {
      "bold": false,
      "border": {
        "bottom": {
          "color": "#000000",
          "style": "none",
          "width": 1.0
        },
        "left": {
          "color": "#000000",
          "style": "none",
          "width": 1.0
        },
        "right": {
          "color": "#000000",
          "style": "none",
          "width": 1.0
        },
        "top": {
          "color": "#000000",
          "style": "none",
          "width": 1.0
        }
      },
      "col": 1,
      "expr": "ds2.select(item, , , item)",
      "extend_mode": "default",
      "font_name": "宋体",
      "font_size": 12,
      "fore_color": "#000000",
      "h_align": "left",
      "indent": 0.0,
      "italic": false,
      "rotation": 0.0,
      "row": 3,
      "split": false,
      "stretch_when_paged": false,
      "underline": false,
      "v_align": "middle"
    },
    {
      "bold": false,
      "border": {
        "bottom": {
          "color": "#000000",
          "style": "none",
          "width": 1.0
        },
        "left": {
          "color": "#000000",
          "style": "none",
          "width": 1.0
        },
        "right": {
          "color": "#000000",
          "style": "none",
          "width": 1.0
        },
        "top": {
          "color": "#000000",
          "style": "none",
          "width": 1.0
        }
      },
      "col": 2,
      "extend_mode": "default",
      "font_name": "宋体",
      "font_size": 12,
      "fore_color": "#000000",
      "h_align": "left",
      "indent": 0.0,
      "italic": false,
      "literal": {
        "type": "null",
        "value": null
      },
      "rotation": 0.0,
      "row": 3,
      "split": false,
      "stretch_when_paged": false,
      "underline": false,
      "v_align": "middle"
    }
  ],
  "col_props": [
    {
      "break_column": false,
      "break_page": false,
      "col": 1,
      "type": "data",
      "visible": true,
      "width": 25.0
    },
    {
      "break_column": false,
      "break_page": false,
      "col": 2,
      "type": "data",
      "visible": true,
      "width": 25.0
    }
  ],
  "datasets": [
    {
      "name": "ds1",
      "sql": {
        "dsn": "kingbase",
        "sql": "SELECT id, dept, name, salary FROM report.emp_info ORDER BY id"
      }
    },
    {
      "name": "ds2",
      "sql": {
        "dsn": "kingbase",
        "sql": "SELECT id, emp_id, item, amount FROM report.emp_bonus ORDER BY id"
      }
    }
  ],
  "extensions": {
    "rpx.legacy": {
      "data": "UlFRUgAABpsAAAAEAAAAAwAAABylQQAAAAEA//////////8BAAAABqztAAVwcAAAAAAAHKVBAAAAAQD//////////wEAAAAGrO0ABXBwAAAAAAAcpUEAAAABAP//////////AQAAAAas7QAFcHAAAAAAABqxQcgAAAEA//////////8AAAAGrO0ABXBwAAAAABqxQcgAAAEA//////////8AAAAGrO0ABXBwAAAAALsAAAAQAAAAAQAAAAEAAAABAAAAAtDhAP8AAAA/gAAAEP///////////////yIxAAEAFVJvb3Qg5oCB77ya5Y676YeNTGlzdP////8AAAAAAAAABuWui+S9kwAM//////8AAAD///////////////8AP4AAAP8AAAAAP4AAAP8AAAAAP4AAAP8AAAAAP4AAAP8AAAD/////ACDA/////wAAAAAABqztAAVwcP////8A/////2FxdnkAAAAAAAAAlP/////Q4QD/AAAAP4AAABD///////////////8iMQD//////wAAAAAAAAAG5a6L5L2TAAz//////wAAAP///////////////wA/gAAA/wAAAAA/gAAA/wAAAAA/gAAA/wAAAAA/gAAA/wAAAP////8AIMD/////AAAAAAAGrO0ABXBw/////wD/////YXF2eQAAAAAAAACg/////9DhAP8AAAA/gAAAEP///////////////yIxAAEACuWOu+mHjUxpc3T/////AAAAAAAAAAblrovkvZMADP//////AAAA////////////////AD+AAAD/AAAAAD+AAAD/AAAAAD+AAAD/AAAAAD+AAAD/AAAA/////wAgwP////8AAAAAAAas7QAFcHD/////AP////9hcXZ5AAAAAAAAAJn/////0OEA/wAAAD+AAAAQ////////////////IjEAAQAD5YC8/////wAAAAAAAAAG5a6L5L2TAAz//////wAAAP///////////////wA/gAAA/wAAAAA/gAAA/wAAAAA/gAAA/wAAAAA/gAAA/wAAAP////8AIMD/////AAAAAAAGrO0ABXBw/////wD/////YXF2eQAAAAAAAAC0/////9DhAP8AAAA/gAAAEP///////////////yIxAP//////AAAAAAAAAAblrovkvZMADP//////AAAA////////////////AD+AAAD/AAAAAD+AAAD/AAAAAD+AAAD/AAAAAD+AAAD/AAAAAAAAIAABKAEAGmRzMi5zZWxlY3QoaXRlbSwgLCAsIGl0ZW0pACDA/////wAAAAAABqztAAVwcP////8A/////2FxdnkAAAAAAAAAlP/////Q4QD/AAAAP4AAABD///////////////8iMQD//////wAAAAAAAAAG5a6L5L2TAAz//////wAAAP///////////////wA/gAAA/wAAAAA/gAAA/wAAAAA/gAAA/wAAAAA/gAAA/wAAAP////8AIMD/////AAAAAAAGrO0ABXBw/////wD/////YXF2eQAAAAAAAABDAAkAAQABAAEAAAAUAAEAAQBkQ1IAAEOUgABBmAAAQZgAAEHIAABByAAAAQAAAgAAAgACAQEAAP////8AAAAAAQAAAP//////////AAABVQACAQAAAC5jb20ucmFxc29mdC5yZXBvcnRsLnVzZXJtb2RlbC5TUUxEYXRhU2V0Q29uZmlnAAAAcQAAABgAAAADZHMxAAAACGtpbmdiYXNlAAAAAAAAAAA+U0VMRUNUIGlkLCBkZXB0LCBuYW1lLCBzYWxhcnkgRlJPTSByZXBvcnQuZW1wX2luZm8gT1JERVIgQlkgaWT///////////////8AAAAAAAAAAQAAAC5jb20ucmFxc29mdC5yZXBvcnRsLnVzZXJtb2RlbC5TUUxEYXRhU2V0Q29uZmlnAAAAdAAAABgAAAADZHMyAAAACGtpbmdiYXNlAAAAAAAAAABBU0VMRUNUIGlkLCBlbXBfaWQsIGl0ZW0sIGFtb3VudCBGUk9NIHJlcG9ydC5lbXBfYm9udXMgT1JERVIgQlkgaWT///////////////8AAAAAAAAA//////////8AAAAf//////////8AAA88/////wMBAAAAAAIAAAAB/////wAAAIUB/////wD//////////wAAAAAAAAAAAf////8AAAAA//////////////////////////8B/////1JRUVJSUVFS",
      "encoding": "base64",
      "format": "rpx-rpx-v1",
      "modeled_sha256": "64c44d9d7c05ea6d8fab51cdea026f1f21af759cce7384a3645433cf918eca53",
      "sha256": "e948de905b44460e873a940e0e8a6c5e0c78c3c74521008eab5271c2002c3616"
    }
  },
  "format": "rpx-report",
  "format_version": 1,
  "grid": {
    "cols": 2,
    "rows": 3
  },
  "row_props": [
    {
      "adjust_height": false,
      "break_column": false,
      "break_page": false,
      "height": 8.0,
      "row": 1,
      "type": "data",
      "visible": true
    },
    {
      "adjust_height": false,
      "break_column": false,
      "break_page": false,
      "height": 8.0,
      "row": 2,
      "type": "data",
      "visible": true
    },
    {
      "adjust_height": false,
      "break_column": false,
      "break_page": false,
      "height": 8.0,
      "row": 3,
      "type": "data",
      "visible": true
    }
  ],
  "schema": "rpx-report/v1",
  "version": 1
}
