{
  "cells": [
    {
      "bold": true,
      "col": 1,
      "font_name": "Microsoft YaHei",
      "font_size": 16,
      "fore_color": "#163D46",
      "h_align": "center",
      "merge": {
        "cols": 7,
        "rows": 1
      },
      "row": 1,
      "text": "销售订单明细表",
      "v_align": "middle"
    },
    {
      "back_color": "#2C4A5A",
      "bold": true,
      "col": 1,
      "extend_mode": "none",
      "font_name": "Microsoft YaHei",
      "fore_color": "#FFFFFF",
      "h_align": "center",
      "row": 2,
      "text": "订单号",
      "v_align": "middle"
    },
    {
      "back_color": "#2C4A5A",
      "bold": true,
      "col": 2,
      "extend_mode": "none",
      "font_name": "Microsoft YaHei",
      "fore_color": "#FFFFFF",
      "h_align": "center",
      "row": 2,
      "text": "日期",
      "v_align": "middle"
    },
    {
      "back_color": "#2C4A5A",
      "bold": true,
      "col": 3,
      "extend_mode": "none",
      "font_name": "Microsoft YaHei",
      "fore_color": "#FFFFFF",
      "h_align": "center",
      "row": 2,
      "text": "客户",
      "v_align": "middle"
    },
    {
      "back_color": "#2C4A5A",
      "bold": true,
      "col": 4,
      "extend_mode": "none",
      "font_name": "Microsoft YaHei",
      "fore_color": "#FFFFFF",
      "h_align": "center",
      "row": 2,
      "text": "销售人员",
      "v_align": "middle"
    },
    {
      "back_color": "#2C4A5A",
      "bold": true,
      "col": 5,
      "extend_mode": "none",
      "font_name": "Microsoft YaHei",
      "fore_color": "#FFFFFF",
      "h_align": "center",
      "row": 2,
      "text": "产品",
      "v_align": "middle"
    },
    {
      "back_color": "#2C4A5A",
      "bold": true,
      "col": 6,
      "extend_mode": "none",
      "font_name": "Microsoft YaHei",
      "fore_color": "#FFFFFF",
      "h_align": "center",
      "row": 2,
      "text": "数量",
      "v_align": "middle"
    },
    {
      "back_color": "#2C4A5A",
      "bold": true,
      "col": 7,
      "extend_mode": "none",
      "font_name": "Microsoft YaHei",
      "fore_color": "#FFFFFF",
      "h_align": "center",
      "row": 2,
      "text": "销售金额",
      "v_align": "middle"
    },
    {
      "col": 1,
      "expr": "d.select(order_id)",
      "extend_mode": "vertical",
      "font_name": "Microsoft YaHei",
      "row": 3
    },
    {
      "col": 2,
      "expr": "d.select(order_date)",
      "extend_mode": "none",
      "font_name": "Microsoft YaHei",
      "left_head": "A3",
      "row": 3
    },
    {
      "col": 3,
      "expr": "d.select(customer)",
      "extend_mode": "none",
      "font_name": "Microsoft YaHei",
      "left_head": "A3",
      "row": 3
    },
    {
      "col": 4,
      "expr": "d.select(salesperson)",
      "extend_mode": "none",
      "font_name": "Microsoft YaHei",
      "left_head": "A3",
      "row": 3
    },
    {
      "col": 5,
      "expr": "d.select(product)",
      "extend_mode": "none",
      "font_name": "Microsoft YaHei",
      "left_head": "A3",
      "row": 3
    },
    {
      "col": 6,
      "expr": "d.select(quantity)",
      "extend_mode": "none",
      "font_name": "Microsoft YaHei",
      "format": "#,##0",
      "h_align": "right",
      "left_head": "A3",
      "row": 3
    },
    {
      "col": 7,
      "expr": "d.select(amount)",
      "extend_mode": "none",
      "font_name": "Microsoft YaHei",
      "format": "#,##0.00",
      "h_align": "right",
      "left_head": "A3",
      "row": 3
    }
  ],
  "col_props": [
    {
      "col": 1,
      "width": 24.0
    },
    {
      "col": 2,
      "width": 24.0
    },
    {
      "col": 3,
      "width": 24.0
    },
    {
      "col": 4,
      "width": 24.0
    },
    {
      "col": 5,
      "width": 24.0
    },
    {
      "col": 6,
      "width": 20.0
    },
    {
      "col": 7,
      "width": 20.0
    }
  ],
  "datasets": [
    {
      "file": {
        "delimiter": ",",
        "encoding": "UTF-8",
        "file_name": "sample.csv"
      },
      "name": "d"
    }
  ],
  "format": "rpx-report",
  "format_version": 1,
  "grid": {
    "cols": 7,
    "rows": 3
  },
  "printing": {
    "auto_size": false
  },
  "row_props": [
    {
      "height": 13.0,
      "row": 1
    },
    {
      "height": 8.0,
      "row": 2
    },
    {
      "height": 7.0,
      "row": 3
    }
  ],
  "schema": "rpx-report/v1",
  "version": 1
}
